2477	what is the role of the house of lords in the british constitution
2479	definition of a solid liquid gas and plasma
2490	when was the last time the crows were in the grand final
2492	who made the song we are the world
2493	when did the movie napoleon dynamite come out
2495	when was the biltmore house opened to the public
2496	when was the last time the dodgers played yankees in the world series
2498	hibel v. sixth judicial district court of nevada
2499	who's the original singer of help me make it through the night
2502	how does one get a star on hollywood walk of fame
2503	who sang once upon a dream at the end of maleficent
2505	who was the walker rick killed in the first episode
2507	who starred in the film far from the madding crowd
2508	jawaharlal nehru centre for advanced scientific research jakkur campus
2509	what inspired huxley to write brave new world
2510	two atoms of the same element that are covalently bonded
2514	when are general elections held in the us
2516	who played the virgin in conan the destroyer
2518	the main idea of limited government is that
2523	who carried florida by 537 votes in 2000
2527	who played mr. kincaid on the partridge family
2529	when should a non rebreather mask be used
2532	when was beowulf most likely composed when did it's events probably take place
2537	who has the right to vote in philippines
2538	where is the niger delta on a map
2545	when did end of the road come out
2547	what features of muscle contraction can be determined from an emg (electromyogram)
2550	what is the secret of the law of attraction
2551	how did the constellation bootes get its name
2553	the left or fast lane is called the number 1 lane
2557	who won an oscar for schindler's list
2558	what is the purpose of the bromophenol blue dye in the samples
2559	what is mercy mercy me by marvin gaye about
2560	when was the mission san antonio de valero built
2565	when did lord howe island became a world heritage site
2573	the most common form of megalithic architecture in europe is
2576	when did the passion of the christ come out
2581	what dynasty completed the great wall of china
2585	what is united nations declaration of human rights
2587	who won women's singles us open 2017
2591	who sings don't take your guns to town
2597	who sang the them song for as told by ginger
2598	where is dia de los muertos celebrated in mexico
2601	when did university stop being free in australia
2602	where do deer mice live in the us
2606	who wrote i want to dance with somebody by whitney houston
2614	where does the black friday term come from
2619	how did orchestra change in the romantic period
2622	what is the third book in the lunar chronicles
2624	where can i get a state issued id
2625	who translated the play neel darpan into english
2626	what must be present for a combustion reaction to occur
2627	the supreme court only have original jurisdiction in two kinds of cases
2633	who played mike stivic on all in the family
2634	who sang what i like about you originally
2636	motion of earth is a combination of motion
2637	gestational sac and yolk sac but no baby at 7 weeks
2638	when did the ship hector arrived in pictou
2643	who is johnny in the devil went down to georgia
2644	in which city are the wimbledon game held
2648	what was the lowest barometric pressure for hurricane irma
2649	why does cooling water run through the condenser
2650	when does a cell have condensed visible chromosomes also known as sister chromatids
2652	how did the communists establish control in the new union of soviet socialist republics
2658	when was the canadian pacific railway started and finished
2659	band who had a hit with heart and soul crossword
2661	the german princes who chose the holy roman empire were called
2662	who sang i knew the bride when she used to rock and roll
2663	where did latin american fit in the post-world war ii world
2669	how long did the menendez brothers get in prison for killing their parents
2671	what is the general structure of an url
2674	the federal communications commission​ (fcc) controls and​ regulates
2676	where was the first sonic drive in located
2680	who sings the song rock you like a hurricane
2682	who has the most conference championships in college basketball
2684	steve martin the jerk tonight you belong to me
2685	an story of country folk slogan used to describe the archers
2686	where did the new york giants baseball play
2687	when is the strictly come dancing results show recorded
2688	who sang the song brother let me be your shelter
2689	what percent of the us population controls the wealth
2690	where does iron ore come from in australia
2695	hart of dixie season 4 how many episodes
2697	who wrote old flames cant hold a candle to you
2699	who sang you'll be a woman soon in pulp fiction
2700	where does a roadrunner live in the desert
2701	who was the first president of the constituent assembly
2702	where did ruth's chris name come from
2703	when did first fast and furious come out
2704	how does the mantle plume model explain the existence of hot spots
2708	in the honour of which god is anant chaturdashi celebrated
2713	what is australia's location in the world and region
2716	difference between deep cycle and starting marine battery
2719	who sang what are we doing in love
2720	at what age are you no longer a toddler
2728	what was the purpose of the bantu education act
2731	what is the snow on mars made of
2732	when does elena turn into a vampire in the tv series
2734	what part of dc is howard university in
2735	what is the first covenant in the old testament
2736	who played arnold winkler on andy griffith show
2739	how did the new deal create a new meaning for liberalism
2742	where is fort myers located at in florida
2744	who became a leader of the indian national congress
2745	what is the filename extension used for all java source files
2746	who cracked the enigma code in world war 2
2747	when was the last time unc did not make the ncaa tournament
2748	what is the emperor's role in japan
2752	who sings blame it on the bossa nova
2755	where is the tierra del fuego located on a map
2757	when was the last time the los angeles lakers won a championship
2758	where is the eagle creek fire located in oregon
2760	who sang the song should have been a cowboy
2761	how many counties does the state of georgia have
2764	where did the name 99 ice cream come from
2773	where can carbon be found in the biosphere
2782	what does the m number mean on a pint glass
2783	other than water what else has hydrogen bonds
2798	dogs name in the grinch who stole christmas
2799	who sings the song one thing leads to another
2800	what does it mean if a car is a fleet vehicle
2801	theme of the song roar by katy perry
2803	are citizens of us virgin islands us citizens
2804	who were the whigs and what did they stand for
2807	mount and blade with fire and sword time period
2808	who pays medical bills in great britain where does the money come from to pay these bills
2809	who plays poppy in the beat goes on
2810	do you have to have a gun permit to shoot at a range
2815	in 1945 which party came into power in england
2816	where does porter fly out of in toronto
2820	phase change from gas to solid is called
2823	where does bird's nest soup come from
2826	when was zero first used in mathematical operations
2832	who sang let me tell you about the birds and the bees
2837	who is the girl in the stone sour video say you'll haunt me
2838	where does the phrase rock chalk jayhawk come from
2840	when did the red guards start and end
2841	when did the blackout end in world war 2
2846	who is the actress that plays penny on the big bang theory
2847	difference in function between rough and smooth endoplasmic reticulum
2859	still crazy after all these years song meaning
2861	what type of rock dominates the earth's surface
2867	when is the end of the football season
2869	the 64-bit version of microsoft windows does not support virtual-8086 mode
2870	what is alpha centauri's approximate distance from earth
2871	chronemics is a temporal factor that considers issues of time
2873	who has won the most olympic medals in curling
2874	in the little mermaid how did ariel's mom die
2877	how does the word crucible related to the book crucible
2883	distance from one side of a bridge to the other crossword
2885	what do you say when you win bingo
2891	when did the smoking ban in public places start
2894	who was the greatest pool player of all time
2895	who is the ceo of crate and barrel
2896	what is the difference between north and south bridge
2897	who were the the continent of the americas named after logically
2898	who hoisted indian flag abroad for the first time
2899	towns on the border of texas and oklahoma
2902	who killed missy in a bend in the road
2903	when did one child policy end in china
2908	how many pitchers does a major league team have
2909	what elements make up great britain's constitution
2913	who is the sixth president of the united states
2922	who plays david in alvin and the chipmunks
2924	who lives at the end of king lear
2925	which body system differentiates a male from a female
2926	who negotiated an agreement with japan concerning the future of korea
2928	what was the final episode of quantum leap
2930	what time do tam tams start in montreal
2932	central idea of poem lines from the deserted village
2934	oppo is sponsor of which country's national cricket team
2936	where is iodine found in the periodic table
2937	what was the real name of saudi arabia
2938	where is the oldest civilization known to man
2940	who stars in real housewives of beverly hills
2942	what are some special products made in mississippi
2946	who won the election for mayor in boston
2947	how many casinos are in atlantic city new jersey
2951	the neoclassical growth theory says in part that
2952	roy orbison and k d lang crying song
2956	the resting stage of the cell cycle is
2957	who plays in the new mary poppins movie
2960	disagreements involving slavery and states' rights were two of the main causes of
2964	how many seasons of the rugrats are there
2966	what is the meaning of one standard deviation
2967	when did ibuprofen become available over the counter
2971	when did the nfl adopt a salary cap
2973	what kind of food did the woolly mammoth eat
2981	lord of the rings what does the ring represent
2983	who sings the skye boat song on outlander
2984	how much of the world's diamonds does de beers own
2987	when did fender start making amps in mexico
2988	the boiling point of water is 100 degrees celsius express this in si units
2991	where is the tibia and fibula bone located
2993	who sings he thinks he'll keep her
2994	what states were most affected by the dust bowl
2995	give the formula for the following substance carbonic acid
2997	where is the table of contents found in a book
2999	who lives on 50th floor of trump tower
3000	bosnia and herzegovina croatia macedonia and slovenia all used to be parts of
3001	where did the idea of democracy come from
3004	what is the money called in south korea
3005	can i do a ride along with a police officer
3007	where do most star formation occur in the milky way today
3008	how does the eighth amendment protect people found guilty of crimes
3011	when was the movie the king and i made
3012	the wave length of radio wave is 1m its frequency is
3013	why does overexpression of rtks lead to cancer development
3024	what is the definition of glory in the bible
3026	duties and responsibilities of captain of the ship
3030	who sings you are a magnet and i am steel
3036	where does the journey start in the canterbury tales
3039	where is the world's largest thermometer located
3040	where did the french immigrants settle in texas
3042	where is the air force academy located at
3046	the most recent technological change to the u.s. economy was
3047	the duluth model is an intervention program that emphasizes
3053	resistance to airflow in respiratory passageways is influenced by
3054	what is the function of a viral capsid
3056	explain the role of glycogenin in glycogen synthesis
3060	during the great depression in the 1930s the u.s. economy experienced a
3061	who wrote the song oh lord won't you buy me a mercedes benz
3063	when was the first epistle of john written
3064	has there ever been a tornado in alaska
3068	when was the last time tug-of-war was an official olympic sport
3070	how long is a whale shark in meters
3075	itai-itai disease was a form of poisoning associated with ingestion of
3076	do all eu countries have to use the euro
3077	saying saved by the bell where did it originate
3079	who are considered to be the founding fathers
3086	what is the function and structure of the nervous system
3087	how do you determine what the root of the triad is
3089	where does the sound come from when you crack your knuckles
3090	what album is help by the beatles on
3091	in the song i drive your truck who is he talking about
3094	who played john coffey in the movie the green mile
3096	when does season 8 of hawaii five o premiere
3097	why was the battle of carnifex ferry important
3104	who sang gonna sit right down and write myself a letter
3108	who talks for belle in beauty and the beast
3112	the part of the cytoskeleton made from the protein actin is called
3113	when did the royal proclamation of 1763 end
3114	when did response to state of the union start
3117	isdn uses b & d channels. what is d channel use for
3119	is there a difference between polycythemia and polycythemia vera
3121	who is known as father of green revolution in india
3122	who sing say you won't let go
3123	who monitor the recovery of the location during a disaster
3125	who sings gimme shelter with mick jagger
3126	where is the taurus mountains located on a map
3128	who sings sugar sugar you are my candy girl
3130	when did the song holiday road come out
3131	where does the arrow of a wind vane point
3134	where was thomas and the magic railroad filmed
3135	who has access to the presidential daily briefing
3136	joyce a portrait of the artist as a young man summary
3138	glycogen and amylopectin are long chains of which simple sugar(s)
3139	who was the editor of the journal jugantor published in the time of swadeshi movement
3142	who wrote were going on a bear hunt
3144	where is hard water found in the us
3145	the japanese pagoda was influenced by the indian stupa
3147	who has the power to approve or veto legislation constitution
3150	how i met your mother the goat episode
3155	how and why were serial novels a phenomenon in the nineteenth century
3156	how many countries touches the land boundary of india
3160	who has won the most world series in baseball
3162	what factors helped the european economy to expand in the high middle ages
3164	who was the viceroy when the simon commission visited india
3168	who starred in an officer and a gentleman
3171	where is the cerebrum of the brain located
3172	when does closure of the ductus arteriosus occur
3174	who is the announcer for price is right
3175	what was the purpose of the enabling act
3176	what is the process to become a santero
3178	who has the best batting average in test cricket
3179	what is best thing i never had song about
3182	striking the funny bone is actually compression of the
3183	what are the main doctrines about the nature of god in judaism
3191	the story of lover's leap in jamaica
3194	the epididymis is a tube in which sperm cells mature
3197	is the monseigneur and the marquis the same person
3200	how are tyrants today different from those in ancient greece
3205	where are red wing irish setter boots made
3208	who led an expedition in search of the northwest passage for the french
3212	who began the age of exploration in portugal
3214	what is the angle of the tower of pisa
3218	which approach to psychology focuses on the body especially the brain and nervous system
3223	how did the dominican republic get its name
3225	los angeles stadium at hollywood park opening date
3226	another name for a hairpin bend crossword clue
3227	when did the nba start playing zone defense
3229	when did gimme gimme gimme start
3233	why is there a provision of reservation of seats in the legislature
3237	where is the mitral (bicuspid) valve located
3238	what did ted do to barney's sister
3239	the first significant restriction on free immigration in u.s. history was the
3240	who sang what condition my condition is in
3242	the combination of biotic and abiotic factors which may limit population increase is called
3243	who played zoe hart on hart of dixie
3244	who was the first english child born in north america
3245	when did the word of wisdom become mandatory
3248	where was the salvation army's christmas collection kettle first introduced
3249	what type of energy do satellites generally use to communicate with earth
3252	where do polar bears live and what's their habitat
3254	who died doing the luge in the olympics
3255	what is the storyline of the movie shape of water
3256	who has the most wins on around the horn
3260	the sum of all numbers from 1 to infinity
3261	the first element on the periodic table is
3262	who owns the golden nugget casino in atlantic city
3263	when was to god be the glory written
3269	where is avon park florida on the map
3273	during periods of high inflation the money supply typically has been
3277	whats the distance between mars and the sun
3278	why was the plague that struck athens so devastating
3279	what does a heart rate of 131 mean
3283	what aircraft can you fly with a ppl
3284	where does the microchip go in a dog
3285	who wrote papa got a brand new bag
3287	when was national service abolished in the uk
3290	what does it mean to fuse the spine
3293	what olympic athlete has won the most medals
3296	what grade was arnold from hey arnold in
3298	when was the first wonder woman comic released
3299	who is the writer of 50 shades of grey
3301	what was the professors name in back to the future
3303	who sang it going to take a miracle
3307	where does the us launch space shuttles from
3308	when did little house on the praire air
3309	where did the peanut butter jelly time song come from
3310	when does new model year start for cars
3311	what is the purpose of a website kick starter
3312	when is the figure skating part of the olympics
3314	when was the letter j introduced to the alphabet
3317	what is one note and how does it work
3320	where are the four disney theme parks located
3326	third president of the united states of america
3327	who abolished the monarchy and declared france a republic
3328	location of the ten commandments in the bible
3329	how long was constantinople the center of the roman empire
3330	when did rob dyrdek's fantasy factory end
3332	roman god of the underworld also called orcus or pluto
3333	who is regarded as the founder of psychoanalysis
3334	where is apennines mountains located on a map
3338	in 1973 congress passed the war powers resolution to
3339	where is the orinoco river located on a map
3340	what does zonia receive from reuben in the play
3341	dynamin is associated with which type of vesicle
3342	when did they stop making the nissan xterra
3343	who played the nurse on andy griffith show
3345	who sang the end of the world as we know it
3354	where does florida natural orange juice come from
3355	meaning of the song we built this city
3365	who plays colin on young and the restless
3372	what is the prince of persia in the bible
3373	when were taxes implemented in the united states
3380	who made the nuclear model of an atom
3385	who does the voice of salem the cat
3387	who played joey's agent estelle on friends
3389	who caused to build qutub minar in delhi
3394	who holds the most home runs in mlb history
3395	who abandoned traditional harmony and created the twelve-tone system for composition
3399	what is the meaning of veronica in english
3400	when did krakow become the capital of poland
3402	where does the saying get out of dodge come from
3403	who plays todd in scott pilgrim vs the world
3405	where did the battle of marengo take place
3406	when did michael jordan return to the nba
3409	who sings the wire season 5 theme song
3410	where are the washington redskins based out of
3411	who sings oh what a night late december back in 63
3413	which note is middle c on a piano
3417	what is the name of the chief justice of ghana
3418	where does the highway of heroes start and end
3423	who runs the senate on a day to day basis
3425	what goes on the bottom of shepherd's pie
3427	when does season 13 of america's got talent premiere
3429	who's winning the election in virginia for governor
3431	who sets the requirements of a single audit
3433	who was elected senator of illinois in 1858
3436	in american history what was the purpose of the period known as reconstruction
3438	who plays nathan's mother on general hospital
3439	difference between an australian cattle dog and a blue heeler
3442	does niagara falls belong to us or canada
3443	what is the maxwell award in college football
3444	when did the movie karate kid come out
3447	when is the met office leaving the bbc
3448	where does junior want to go to find hope
