1244	how many pieces in a terry's chocolate orange
1247	what is the oasis in ready player one
1248	what was the name of the horse in steptoe and son
1251	which indian actor has won most national awards
1255	what are the types of information system application
1259	where is virginia beach located on a map
1262	when is equilibrium reached in a chemical reaction
1265	what happened in the philippines after the united states annexed it as a territory
1266	what is the role of the us attorney general
1267	where did the methodist church get its name
1269	where did the punch brothers get their name
1283	when was the last time giants won superbowl
1284	what is the purpose of the vietnam war
1287	who plays the lion in the movie zookeeper
1291	where did hope on bold and beautiful go
1292	where did they get the vibranium to make captain americas shield
1295	when did we find out the smoking man was mulder's father
1296	how many seasons has greys anatomy been on tv
1298	how did leo dalton die in silent witness
1300	who played young clark kent in 1978 superman
1302	where do they film the ranch on netflix
1304	when was the suite life of zack and cody made
1305	where does the sun hit the us first
1306	olaudah equiano the interesting narrative of the life summary
1313	who sang nice day for a white wedding
1316	is there a train station at weston super mare
1318	what are the titles of a board of directors
1319	who was president when the panama canal was built
1322	where does prime rib come from on a cow
1325	who plays joker in batman the dark knight
1328	who validated the civil rights movement by proclaiming we shall overcome
1330	why do we celebrate holi festival in hindi
1331	what is the common name for gravitational force
1332	region of antarctica where march of the penguins filmed
1333	what went wrong on the columbia space shuttle
1337	who sang raindrops keep fallin on my head
1338	the sons of liberty who were they and what did they do
1340	how many wars held between india and pakistan
1344	where is salamis in ancient greece on a map
1346	what is a live well in a boat
1348	who sang the theme song to step by step
1352	vine with heart shaped leaves and white flowers
1353	where does the thames river begin and end
1356	protein identification the origins of peptide mass fingerprinting
1363	who did cubs beat in 2016 world series
1370	what was the first kind of vertebrate to exist on earth
1374	when did harvard become an ivy league school
1375	when does the call of the wild take place
1380	who played the original steve mcgarrett on hawaii five-o
1381	what year did return of the mack come out
1382	the xix of the social security act of 1965 established
1383	when was the bridge over the hoover dam built
1389	what does sip stand for in the ngn / ims context
1396	where is sinai peninsula located on a map
1405	what is the meaning of 4wd in cars
1413	what is the difference between airasia x and airasia
1414	when did bird is the word come out
1415	where was the remake of wake in fright filmed
1425	what does the number represent in the middle of the wind rose
1429	are hash browns and tater tots the same
1434	is aluminium a ferrous or non ferrous metal
1436	did mary kate and ashley share the role of michelle
1445	who is the singer of kal ho na ho
1446	why was it important to have illustrated manuscripts of the bible
1449	who did bette midler portray in the rose
1453	the vast interior rural area of australia is known as the
1455	who is the masked magician in breaking the magician code
1457	where did the word john doe come from
1459	the era of the great mughals began with the accession of
1460	distributes the powers between union and state government in federation
1463	where did the world's largest recorded wave occur
1464	when did hyderabad became a part of india
1465	what does it mean groundhog sees his shadow
1469	who are the leaders of the jehovah witnesses
1472	what parts make up the peripheral nervous system
1473	what is the source of electrons during photosynthesis
1475	when can a noun be used as an adjective
1478	when was the miraculous journey of edward tulane published
1482	where did the idea of fortnite come from
1484	the south west wind blows across nigeria between
1487	what happens to the rbc in acute hemolytic reaction
1489	when is the last time the philadelphia won the superbowl
1494	how many episodes are there in dragon ball z
1499	who designed the garden city of new earswick
1500	what is the first step in the evolution of the eye
1502	where is gall bladder situated in human body
1505	right to property according to the constitution of india is a
1507	what is the use of adobe flash cs3 professional
1509	what part of the brain is in the middle cranial fossa
1515	in which sea pearl is found in india
1516	where does kylo ren's name come from
1520	who sings the theme song for the proud family
1521	who wrote cant get you out of my head lyrics
1524	where does the story the great gatsby take place
1527	who may be affected by monetary penalties imposed by the irs
1528	who turned out to be the mother on how i met your mother
1535	a best alternative to a negotiated agreement (batna)
1536	who is the girl in green day 21 guns
1540	india and china went to war in 1962
1542	who was the pitcher who broke his arm
1547	the cuban revolt against spain was led by
1553	who wrote the song the glory of love
1559	who said if a tree falls in the woods and nobody hears it
1561	who has given the theory of unbalanced economic growth
1563	who led the soldiers in ending the raid on the harper's ferry arsenal
1570	where does kevins family go in home alone 2
1572	how has australia been influenced by other cultures
1576	will there be a third season of the durells in corfu
1578	how tall is the actor who plays hagrid in harry potter
1579	who won the oscar for best picture in 1976
1581	where are located the acetabulum and the glenoid cavities
1585	who's playing in the world series and when is it
1588	what album is sacrifice by elton john on
1591	what continents does the ring of fire touch
1593	which site of an enzyme is called allosteric site
1595	who sings the song you'll never find another love like mine
1596	where was the original flight of the phoenix filmed
1602	who is the guy who walked across the twin towers
1603	all the motor neurons that control the skeletal muscles are
1604	when do you hear the lub and dub sounds of the heart
1606	who has scored more goals in the premier league
1607	total number of mna in pakistan national assembly
1608	where do we draw the line between painting and drawing
1612	what was the purpose of a revival meeting during the second great awakening
1614	what is the official symbol of the carnival of quebec
1615	which apostle spoke at the council of jerusalem
1616	actor who plays eric on boy meets world
1618	was nightmare before christmas originally a disney movie
1621	what was the first video game for nintendo
1626	when was the minimum wage established in the united states
1627	where is kruger national park in south africa
1630	how many books are in the diary of a whimpy kid series
1636	who want to be a millionaire calls his dad
1650	who played mark on the show the rifleman
1653	when was where have all the flowers gone written
1654	how did the apostles creed get its name
1656	what is a real world application of an atwood machine
1657	who starred in the movie natural born killers
1658	who wants a heart in the wizard of oz
1660	when did the song the joker come out
1661	what is the tigers name in life of pi
1662	when did the 5 day work week begin
1663	where is the north pole on the world map
1664	when did the us stop drafting for the vietnam war
1665	who performed the halftime show at super bowl 51
1669	who plays sheila carter on the bold and the beautiful
1672	what is the share of agriculture in indian economy
1674	who sings the song it ain't me
1675	what us president is the only president to become an eagle scout
1676	how much does it cost for the olympics
1677	when is the womens ice skating for the olympics
1680	where does the optic nerve cross the midline ​
1681	what gun does the california highway patrol use
1684	who painted the ceiling of the florence cathedral
1685	who sings too much time on my hands lyrics
1686	who has hosted the most fifa world cups
1687	what was one effect of the camp david accords 1977
1688	why does prince edward island have red sand
1689	which is the lion's mane jellyfish's species within its genus
1699	who did cora marry in once upon a time
1702	where does the seven ages of man come from
1703	who sings that aint no way to go
1707	when does the cannes film festival take place
1710	what happened to the fourth member of destinys child
1712	where did the violin get its name from
1713	who sings tie a yellow ribbon around the old oak tree
1715	why did the attack on pearl harbor take place
1716	who plays elsa's aunt in once upon a time
1717	where was held the first session of muslim league
1718	what is the name of the dragon in eragon
1719	where is the emerald ash borer found in the us
1720	points outside the production possibilities curve represent combinations of products that are
1724	ed edd n eddy double d boy or girl
1725	who is the head a in pretty little liars
1726	how many models are there in iphone 6
1734	who played raquel in only fools and horses
1739	when did how you remind me come out
1740	what is the role of hcl in the stomach
1741	the joint between a coxal bone of the pelvis and the sacrum
1742	what is the song in red dead redemption
1743	in a microsoft access table what does a row of information represent
1744	once upon time in india kis film ka tag line hai
1747	who is the presiding officer of legislative council in india
1748	when was son of a preacher man released
1749	when did the first train run in england
1750	when did the united kingdom entered world war 2
1752	what does a major depressive episode look like
1758	what is the supreme court's major power
1767	where does the white witch live in narnia
1772	does laser hair removal have any side effects
1777	when does auto start-stop automatically shutdown the engine
1779	who produced a change is gonna come
1782	who wrote knock knock knocking on heavens door
1789	who sang the song you got a friend in me
1790	mention any two function of the speaker of the lok sabha
1791	what is nginx and what is it used for
1792	where does a wrinkle in time take place
1793	the outer layer of the skin that contains no blood or nerve supply is the
1797	who conducted the opening concert at carnegie hall
1798	what was the purpose of masks in greek theatre
1799	who was involved in the currency act of 1764
1800	where did students for a democratic society start
1802	what is the meaning of the song fool on the hill
1806	who became king of erebor after thorin dies
1811	rain sleet or snow that contains a high concentration of acids is called
1813	who plays jack skellington in nightmare before christmas
1814	what is the main issue behind starlink corn
1815	oldest recording of house of the rising sun
1822	does reaching base on an error count as an at bat
1824	what was the primary goal of the first green revolution
1826	who plays red on orange is new black
1829	where does blood go when it leaves the pulmonary artery
1836	what is the most popular religion in sweden
1838	where can oxygen be found in the world
1839	who decides where the super bowl is played
1840	where was the last scene of goonies filmed
1841	what was the divestment social movement in south africa
1843	what does g stand for in ncis los angeles
1845	who is in charge of ratifying treaties in the us
1847	who sang i'm gonna run away from you
1848	who plays whitey bulger's girlfriend in black mass
1849	who came up with popcorn at the movies
1853	how many episodes of touching evil are there
1854	where is the cartilaginous joint found in the body
1855	bible verse about honor thy mother and father
1856	who sang the song a white sports coat and a pink carnation
1857	who wrote shes always a woman to me
1858	where does new crust come from in sea floor spreading
1862	a musical instrument with strings beginning with c
1863	which brazilian player is known as the black diamond of football
1865	where do you get a cashiers check from
1866	who played guitar on my guitar gently weeps
1867	when was the last time beijing hosted the winter olympics
1869	where does the phrase jumping the shark come from
1870	marsupials are found in north america and australia
1874	the witch and the hundred knight 2 us release
1879	ganglion axons forming the optic nerve run to the
1885	what is the director's cut of a movie
1889	what language is the olympic anthem sang in
1891	who was the actor that played ben stone on law and order
1893	where is the amazon river located in south america
1894	who invented the glasses that give sight to the blind
1897	what happens when you dont rotate your tires
1900	which abbott and costello movie has who on first
1902	how did the california gold rush affect the growth of california
1905	when was the movie cool hand luke made
1911	who was the president of pakistan during 1971 war
1914	which type of fire detector uses the effect of smoke on a light source and photo-electric cell
1916	when do federal and state courts have concurrent jurisdiction
1918	who stole the mona lisa from the louvre in 1911
1920	when did billy don't be a hero come out
1925	what information is displayed in clear text from the ftp header
1934	what is the meaning of the oklahoma flag
1935	simple minds live in the city of light album cover
1936	when did south sudan join east african community
1938	who votes in the speaker of the house
1943	where were the soviet missiles located in cuba
1945	votes required to pass a bill in indian parliament
1947	when was the r10+20 summit in rio de janeiro held
1949	location of khasi hills on map of india
1952	where did the term 'robot' come from
1955	wal-mart is a prime example of which type organization
1956	where do the florida marlins have spring training
1958	when was the term social justice first used
1960	who changed the role of the first lady
1961	where are the bahamas located in relation to the united states
1963	what is the name of the compound p4010
1969	when was harry potter and the philosophers stone published
1971	who played the judge in good will hunting
1976	who are the parents of the three fates
1977	who sang the song with reba does he love you
1978	what was the reason for federation in australia
1979	what is the source of information for account receivables
1980	who laid the foundation for indian national congress
1986	where does the eurostar train arrives in london
1987	where is the federated states of micronesia located
1990	who sings every light in the house is on
1991	how many stores does lowes have in canada
1994	where in the bible are the 12 disciples
1996	what is the meaning of the harp in ireland
1999	when was hitchhiker's guide to the galaxy made
2000	when does madea's family funeral come out
2001	who has the highest score in pac man
2003	where is the pacific ocean located on the world map
2005	where does the name loyola university come from
2008	who is playing halftime show super bowl 50
2009	where do rory and paris go to college
2010	who plays eowyn in lord of the rings
2011	who was the winner of the first indianapolis 500
2014	what does the ghost of christmas present sprinkle from his torch
2017	where was part of the classic surfing movie endless summer filmed
2018	where do the question marks go in spanish
2020	who wrote he ain't heavy he's my brother lyrics
2022	when was the lupus foundation of america founded
2026	which is the default file extension for an audio file in windows media player
2029	who plays connor's mom in madeas christmas
2030	hazels boyfriend in the fault in our stars
2031	do fish fall from the sky when it rains
2033	what does the olive branch represent in the olympics
2040	when did the us cut off trade with cuba
2045	when did seattle slew win the triple crown
2047	what is the difference between emery board and nail file
2048	who did michigan state play in the rose bowl
2050	when does the team find out prentiss is alive
2052	who plays the dad in girl meets world
2053	who are you in assassin's creed 4
2054	who destroyed the first temple and exiled the two tribes of judah to babylon
2055	where is the white castle that harold and kumar go to
2056	when was child benefit paid for the first child
2061	song have i told you lately i love you
2062	when did britain set up east indian trading company
2064	when did david akers kick the 63 yard field goal
2066	where does the papillary layer of the skin lie
2067	who has become the new chairman of sebi
2070	when was kudzu introduced to the united states
2071	the radiographic term used to describe the dense bone of the socket and septal crest is
2072	where was the tv show friday night lights filmed
2074	indian cricketer who has the highest test batting average in cricket
2076	i feel like i'm fixin to die woodstock
2078	who invented the first computer game in 1962 and what was the name of the game
2079	who sings somebody's watching me with michael jackson
2082	where does the saying uncle sam come from
2085	who played the mom on what's eating gilbert grape
2090	what are the roles of international monetary fund
2092	who was the bad guy in silence of the lambs
2093	epidemiologists attempt to explain the link between health and variables such as
2094	when was night at the museum 3 filmed
2095	meaning of phil collins another day in paradise
2096	what mall did they use in back to the future
2098	in a double-reciprocal or lineweaver-burk plot the km is found from
2103	what is the approximate volume of blood in your body
2106	what type of novel is goodbye mr chips
2108	when does buffy tell her friends she was in heaven
2109	the recipient of first jnanpith award was an author which language
2110	who was the first to declare the mutiny against the british
2115	true or false the term big data refers only to the amount of data being generated
2116	how did long john silver lose his leg in treasure island
2119	who did the mavericks beat in the finals
2120	who is the actor that plays sneaky pete
2125	when did virgin australia (formerly virgin blue) commence flying in australia
2126	where is the condenser located on a microscope
2128	who sings the song only in my dreams
2129	where is the capital city of alabama located
2131	when were social security cards issued at birth
2133	what is george harrison song wah wah about
2136	who led the conquest of the incas in south america
2137	who sings the pokemon theme song season 1
2139	where does wild caught sockeye salmon come from
2140	who added a press room to the white house
2141	what was the religion in persia before islam
2142	why does kerosene oil rise up in the wick of lantern
2143	mention the chemical change that proinsulin undergo to be able to act as mature insulin
2144	where does the sweetness of fruit come from
2145	what's the difference between a camel and dromedary
2146	an object that moves around an external axis is said to be
2148	what was the name of the plant on little shop of horrors
2150	when does wonder woman come out on blue ray
2151	who heads the executive department of west virginia government
2154	when did the uk and us become allies
2156	where is singapore on the map of asia
2158	what year did the us hockey team won the olympics
2161	what is loihi and where does it originate from
2167	where do elk live in the united states
2170	where are the organ mountains in new mexico
2176	who wrote the song photograph by ringo starr
2179	dominant alleles are always the most common allele in a population
2181	what’s the difference between downhill and super g
2183	where are the giant redwoods located in california
2184	who has made the most premier league appearances
2185	who was the first chief minister of west bengal
2186	two main types of research methods used in psychology
2189	when was the first hunger games book published
2191	where did the race in grease take place
2192	what is the maximum data rate for the 802.11a standard select one
2193	a good that can be used in place of another good
2197	where does the term dog and pony show come from
2198	who is recognized as the founder of islam
2199	why do tokyo and kyoto have the same letters
2204	what are the different types of mountain biking
2207	where does the movie proof of life take place
2208	who breaks a tie in the us senate
2212	what type of fuel goes in a zippo
2213	first jnanpith award was an autor of which language
2216	how many countries does cadbury sell its products
2218	ethiopia flight 961 crashes in to the sea
2219	where is mount st. helens located on a map
2220	where does the mary river start and finish
2224	the origins of the stations of the cross
2227	who did the dominican republic gain its independence from
2231	where does the bob and tom show broadcast from
2233	who won the champions league final in 2016
2240	when did beryl markham fly across the atlantic
2243	when did african isolation from the european old world occur
2244	who does brant daugherty play in pretty little liars
2246	how long is a day in majora's mask
2247	here we go round the mulberry bush origin
2248	when did under the cork tree come out
2249	when did korea separate into north and south
2251	what is the purpose of the muscles that line the esophagus
2253	where does eye of the round roast come from
2254	who sings the song let me love you
2257	how many inches is the iphone 5s screen
2258	where do the signals for apoptosis come from
2260	who made delhi as capital for the first time
2262	who gave the famous objective co relative theory
2264	when did cable stayed bridges increase in popularity
2265	does newman's own really give all profits to charity
2267	is the son of the beast still at kings island
2268	where do bullets go when fired in the air
2275	when was the death penalty reinstated in oregon
2277	what was icq as related to instant messaging
2278	chandra and bhaga river meets at the place
2279	who took part in the american civil war
2281	what was the most important new religious figure of the new kingdom of ancient egypt
2286	where are haploid cells found in the human body
2292	where does the chinatown bus stop in nyc
2293	when did the right to buy scheme start
2294	who sang will i see you in september
2306	who is the valley of the dolls based on
2307	why is there a ball in guinness beer
2310	where are trigger points located in the body
2317	who plays justin hammer in iron man 2
2322	who said i think there is a world market for maybe five computers
2324	where does the friday the 13th superstition come from
2327	the rime of the ancient mariner albatross symbolism
2330	where was percy jackson and the olympians filmed
2331	what is foreign account tax compliance act (fatca)
2332	how many indian prime ministers were born in independent india
2334	what is henry james the real thing about
2343	who is the new york state senate majority leader
2344	who created the pieta and also painted the ceiling of the sistine chapel
2346	who played cory's older brother on boy meets world
2349	where is cinque terre italy on a map
2352	which river separates the bronx in new york city from manhattan island
2353	where does the red wolf live in the world
2358	who acts as the chairman of the election commission
2361	who wrote the song always be humble and kind
2364	bowler to take hattrick in both inning in test match
2365	what is the width of a cricket bat
2366	who played alex cross in along came a spider
2368	who came up with the first working periodic table
2369	when did cybermen first appear in doctor who
2372	what does the keys to the city mean
2374	who won the nobel peace prize for 2017
2375	what does the song gravity by sara mean
2378	why was hong kong important to the british empire
2379	where does cleavage of the peptide bond by chymotrypsin occur
2381	how long did it take to build the great pyramid of egypt
2385	where do the secretory cells of endocrine glands secrete their products
2389	who said beware of the ides of march
2390	when does season 6 of the next step start
2395	when was the dome of the rock completed
2397	who explored waters of cuba the bahamas and hispaniola
2398	why is southern ireland not part of the united kingdom
2402	what is the order of the netflix marvel shows
2403	where do you get male pattern baldness from
2405	who played mama odie in princess and the frog
2406	who represents the insured in the investigation of a claim
2410	what is the name of the weapon the grim reaper carries
2413	who plays captain phasma in star wars the force awakens
2415	when does a dieback or population crash occur
2416	who wrote when a man loves a woman
2418	who did puss in boots grew up with
2422	where does the last name waters come from
2424	in new york the supreme court ranks below the court of appeals
2425	when did where are you now come out
2429	who sang i want to be bobbys girl
2430	where are the cones in the eye located
2434	great tang dynasty record of the western regions
2438	when does april fools day end at noon
2442	how many times have the winter olympics been in the usa since 1924
2445	where is the intermountain region located on a map
2446	what is the setting of a dolls house
2447	who plays the grandmother in game of thrones
2448	what is the approximate volume of the brain
2449	name the tissue type of the inner most layer of cells
2452	what is one of the main goal of the democratic party
2454	what is novichok and what does it do
2456	what river flows through charleston west virginia’s capital
2457	who sings so come and dance with me jai ho
2461	of which country is sofia the capital city
2462	when does the heart develop and begin pumping blood
2467	who propounded the idea of basic education in india
2468	when did korn's follow the leader come out
2471	where are the san juan mountains in new mexico
