0	what is non controlling interest on balance sheet
1	how many episodes are in chicago fire season 4
2	who sings love will keep us alive by the eagles
3	who is the leader of the ontario pc party
4	nitty gritty dirt band fishin in the dark album
6	converting stereo signal to mono signal is called
7	in order to prove disparate impact you first must establish
10	when is the new tappan zee bridge going to be finished
11	who recorded i can't help falling in love with you
13	when did they stop cigarette advertising on television
17	when did the us take over wake island
18	when did american two party system began to emerge
19	where are the mitochondria located in the sperm
21	how many seasons of the oc are there
23	how dose the poet present death as a voyage in crossing the bar
26	2. what are the reasons states impose protectionists policies on other countries
27	where are they building the new raiders stadium
28	what event provoked congress to propose the eleventh amendment and the states to ratify it
32	what are bulls used for on a farm
40	when was theme from a summer place released
41	when does jenny humphrey come back to gossip girl
42	when did athens emerges as wealthiest greek city state
45	who invented the frisbee and how did it get its name
46	who plays v on orange is the new black
52	who sang in the movie i walk the line
53	where did aeneas go when he left carthage
60	when were the winnie the pooh books written
61	where does the electron transport chain pumps protons
64	where is the slide placed on the microscope
65	when was the seat moved to the capitol
71	a justice of the supreme court may write a dissenting opinion to
74	who named all the animals in the world
75	how long do nhl players stay on waivers
76	what year did the price is right first air
79	who sings jungle book i wanna be like you
80	which best describes timbuktu under the mali empire
81	who sings two pints of lager and a packet of crisps
82	when did the apple iphone se come out
83	where do they put the tomb vampires in order to burn them during founders day
86	how many super bowl games has the patriots played in
92	when is the haunted mansion nightmare before christmas
94	who sings it's my party and i cry if i want to
97	when was you'll never walk alone first released
103	who did puerto rico belong to before the u.s
104	when does panic at the disco album come out
107	who sang on great gig in the sky
112	when is the last time the dolphins went to the superbowl
114	what is the concept of unfair labor practice in labor code
116	who was the last nba player to get drafted out of high school
119	where does transduction occur in the auditory system
121	how many kilometers of great wall of china
122	what is the name of the restaurant in seinfeld
124	when did the log flume closed at alton towers
126	where did little mix come in x factor
129	who was the declaration of independence written for
130	what is the center of heredity in a cell
131	when did the first immigrants come to hawaii
132	who coined the phrase let get ready to rumble
133	who played the first nfl thursday night football game
134	how many different kinds of pokemon cards are there
136	who sang the theme song for laverne and shirley
139	who created the very first adhesive postage stamp and what year
140	do you cut cards to the left or right
141	who were the first settlers in san antonio
142	who were the members of the traveling wilburys group
147	how did the federalists and anti federalists compromise
148	product-market fit means being in a good market with a product that can satisfy that market
149	where do kidneys for kidney transplant come from
150	the cross section of a stem of tree has 50 rings what is the age of the tree
151	what is on a mcchicken sandwich from mcdonalds
154	what year did the golden state warriors win their first nba championship
155	where did the phrase pop goes the weasel come from
158	ranjit sagar dam has builded over which river
162	what is the average time in hospice care
164	who won the american league pennant in 2017
167	what is the population of the tri-cities washington
168	how does one become a member of phi beta kappa
171	who sang the song i think we're alone now
174	what is the meaning of https //
176	what do you need to know about net neutrality
177	who plays the little girl in jurassic park
179	where in the constitution is the executive branch referenced
180	when is the second half of vikings season 5 coming out
181	• when is a spearman correlation meant to be used instead of a pearson correlation
183	which gene segments code for the variable region of the heavy chain
184	sri lanka belongs to which part of asia
187	who sings gimme some lovin in days of thunder
188	how many episodes of greys anatomy season 14
189	the road that connects the tombs is called
190	where can you find blue bell ice cream
191	who proposed evolution in 1859 as the basis of biological development
192	does the jungle book take place in india
194	what is the function of the semicolon in a c statement
197	where does summer of the monkeys take place
199	why was the statue of liberty given to the us as a gift from france
200	when does ellen's new game show start
202	what is the meaning of the book of proverbs
205	which body part(s) occupy the greatest portion of the primary motor cortex
206	active transport performs which function in a cell
207	who was fighting in the civil war in england and about what
208	who wrote the song what child is this
210	what is the use of silvering the walls of thermos flask
211	when did the eagles last play in a superbowl
213	who won the most mvp awards in the nba
220	who was the grandfather on the cosby show
225	when does a company decide to split stock
232	who opens the church of the holy sepulchre
234	what is the song ticket to ride about
235	when was how deep is your love released
237	is carbon tax an example of a pigovian tax
238	where does creatine come from in the body
239	what happens when iron reacts with oxygen and water
245	why is the ball and stick model not a true representation of the structure of an ionic compound
246	where does the lincoln highway begin and end
248	who sang never gonna let you go
250	what is the function of red bone marrow
255	the golden age of india took place during the rule of the
256	when is the world consumer right day celebrated
257	what is the purpose of a jake brake
258	when does an x sound like a z
261	who sings i feel love with the blue man group
263	what was the meaning of the song puff the magic dragon
264	the type of display that google glass presents to its users is called what
266	who is the world war 2 memorial dedicated to
267	who won the battle of the first battle of bull run
274	who failed the boards on grey's anatomy
275	where did the battle of corinth take place
278	where does the sun lie within the milky way galaxy
279	country song when we get behind closed doors
280	the cold dry winds that blow over northern india in winter are called
283	what category was hurricane charley when it hit florida
284	what are the different types of train cars
293	when did toyota start making cars in the us
294	who was the oldest man elected president of usa
296	who was ursula the sea witch based on
300	what percentage of global man-made co2 emissions comes from worldwide aviation
304	when did marathon change its name to snickers
305	how does montgomery died in the island of dr moreau
306	what were the results of the development of florida's railroads
308	a synonym for the content component of communication is
309	the initial unification of upper and lower egypt took place during which period
310	where is the new football stadium in atlanta
311	where do the sharks play in san jose
314	marc anthony my baby you dedicated to his daughter
316	love me i'm a liberal song meaning
318	who represented the state of tennessee in the scopes trial
322	is kermit the frog part of sesame street
324	who won the battle of britain in ww2
327	what river is associated with the city of rome
330	how long do former presidents get secret service protection
338	for complaints of sudden chest pain patients should take a
339	where is the majority of phosphorous stored in the environment
341	what is the name of the first earthquake early warning system
349	who played bailey in the sisterhood of the traveling pants
353	what were some accomplishments of the han dynasty
354	what type of data is provided in a knowledge base
355	what is an open university grade 3 pass
356	what happened to regina's mother on switched at birth
357	what episode of pll does jenna get her sight back
360	where do green tree frogs go during the day
363	what is the main industry in the canadian shield
364	how does the us government form a more perfect union
365	what makes a mini bike a mini bike
368	who is usually appointed as the chief justice of india
370	what is the origin of the name marvin
371	where did immigrants enter the us on the west coast
373	how many episodes of sabrina the teenage witch are there
375	what is the lead singers name of staind
378	the heart muscle is stimulated to contract by electrical impulses which are generated where
381	who sang my bucket got a hole in it
382	what is the main difference between lymph and interstitial fluid
384	where is creatine phosphate found in the body
388	when did the cubs won a world series
389	india's first arctic research station set up in 2008 what is the name
390	where is cilia located in an animal cell
392	when does lana and clark get back together
395	who painted the world famous painting the last supper
397	atlantic ocean's shape is similar to which english alphabet
398	who is credited with creating the gothic art movement
400	what is the name given to the common currency to the european union
405	who has won the most united states championships
407	the actual name of the confederate force at gettysburg was
410	who is darrell brother in the walking dead
411	where does the brazos river start and stop
419	what nfl coach has the most wins ever
420	when did all night long come out lionel richie
422	when do we use facework to manage the impression others have of us
423	who is the song diamonds and rust about
428	i will die to defend your right to say it
431	the function of the excretory system is to help maintain homeostasis by
436	what is the highest peak in the ozarks
445	who is the owner of the crowne plaza
449	procol harum a whiter shade of pale bach
453	batman and robin episode only fools and horses
456	who wrote hallelujah i just love her so
457	the roman name for a liberal arts education is known as
459	dallol crater in the afar region of ethiopia
461	who was the spanish civil war fought between
462	where is the suez canal located on a map
463	who controls the consolidated fund of the state
466	who sings i can't take my eyes off of you
469	who won the icc under 19 world cup 2018
471	what did the treaty of paris do for the united states
473	who played morticia in the addams family tv show
475	when was pac man released in the us
480	when did the international space station go into space
481	who sang it's a mean old world
482	what are the 4 types of nitrogenous bases
484	where did they film ghosts of girlfriends past
488	who plays voldemort in harry potter and the philosopher's stone
489	where did the battle of lexington and concord occur
491	who has the most super bowls in nfl history
493	what part of indiana is in eastern time zone
496	symbolic interactionism is the basis for which theoretical model
497	who wrote the french declaration of the rights of man and of the citizen
499	who wrote hit me baby one more time
500	where did remember the titans camp take place
503	when did the song push it come out
504	meaning of show me the meaning of being lonely
509	when did the subway open in new york
511	what type of boundary was the mexico earthquake
517	blue mink by the devil i was tempted
519	a treaty is favoured over municipal law pursuant to the principle of pacta sunt servanda
523	when did brent barry won the dunk contest
532	who is the longest serving chief minister in india as on jan 2015
533	most runs ever scored in a mlb inning
537	in which country were the two battles of el alamein fought
540	baga beach is in north or south goa
541	when was the first case of alzheimer's diagnosed
547	what type of car is a g wagon
548	who sings angel of the morning in deadpool
551	who pays for work done on holmes makes it right
554	when did world war 2 end in the pacific
555	what is the story of the very hungry caterpillar
559	what is the legal age for marriage in australia
564	describe how thermal regulation is different in ectotherms and endotherms
565	where was the new pete's dragon filmed
566	is it marley and me or marley and i
569	what kind of animals live in the great victoria desert
572	who played tom hagon in the godfather series
574	where are alkali metals located on the periodic table
578	what is the use of ibm lotus notes
581	what were rough riders in the spanish american war
582	colby chees is named after a town in what state
588	what episode does lori die on the walking dead
589	who is the girl that played darlene in roseanne
591	what is the account number of airtel payment bank
593	who did the original spirit in the sky
594	who was elected president in mexico in 2000
602	who were the judges on dancing on ice 2014
611	when did the military plane crash in mississippi
612	when did they stop using aluminum wiring in ontario
615	this type of nuclear decay effectively turns a proton into a neutron
616	what event marks the beginning of the great depression
618	where does the us men's national soccer team practice
619	where does a brisket come from on a cow
620	when did to kill a mockingbird become popular
622	who plays the genie in aladdin the musical
624	which of these mountain ranges in india's longest railway tunnel constructed
627	how many hoops are used in a game of croquet
628	who starred in the movie romancing the stone
630	who founded amazon where is the headquarters of amazon
634	when did ford change the f150 body style
636	information about the song imagine by john lennon
637	where are the first nations located in canada
641	who played little ricky on i love lucy show
644	german word for pleasure from someone else's pain
645	who scored the most points in a game nba history
647	who is the no. 1 ranked tennis player in the world
651	when did ireland gain its independence from england
652	what is the real story of five nights at freddy's
653	when was the book pride and prejudice written
654	the casualty projections for an invasion of the japanese home islands
655	where will you see polaris in north pole
656	who sang buddy can you spare a dime
662	who sang the song tell me something good
669	who started ww2 and how did it start
671	what happened to the west wing of the white house during a christmas party in 1929
674	the site of dust cave in alabama is interesting for archaeologists because
675	brian cox wonders of the universe episode 1
678	when was the last time an nba backboard broken
685	how many points are scored for a touchdown in american football
687	new mexico was admitted to the union as the . . . state
689	who was the first imperial power that was fighting in vietnam
693	who developed the first printing press in 1430s
695	when do wood thrushes fly when they are migrating
697	how long is one full rotation of the earth
698	the 100 what did clarke do to be in jail
700	when did australia 2 win the america's cup
703	who is hosting e live from the red carpet
706	mainland greece is a body of land with water on three sides called
708	when does middle-earth shadow of mordor come out
715	who wrote the song fly me to the moon
716	who discovered one of the first taxonomic classification schemes
730	who wrote the song rainy days and mondays
733	who designed the traffic circle in long beach ca
734	what type of tale is the pardoner's tale
735	who scored fastest 10000 runs in test cricket
737	when did red dead redemption 1 come out
738	when was the first driver's license required
740	who is next in line to inherit the british throne
742	how many writes does a flash drive have
743	how many ammendments to the constitution have there been
746	original cast of natasha pierre and the great comet of 1812
748	who kicks the ball first to start a football game
750	who votes in the baseball hall of fame
751	who played taylor on the bold and beautiful
753	who expanded the palace of versailles to its present size
758	when did canada gain independence from great britain
761	where do the rockefeller christmas trees come from
765	where is wake forest located in north carolina
767	the head of government in a parliamentary system
773	when did the three little pigs come out
775	who is the first president to be impeached
776	papayas were suffering from what pathogen on the big island of hawaii
780	who wrote the song would i lie to you
781	number of films in lord of the rings
783	is jaffa cakes a biscuit or a cake
784	who does the voice of stewie family guy
785	auditing is the process of verifying the accuracy of the financial statements
789	who is the actor that plays jt on the young and the restless
790	when was the first commercial cell phone released
791	who is casey at the bat based on
792	when did the first ice age come out
793	analysis of our casuarina tree by toru dutt
795	who is the lead singer of collective soul
802	what is the white stork a symbol for in western culture
804	when do you declare honors in contract bridge
805	describe the three phases of the normal blood clotting process
808	who created separation of powers and checks and balances
812	what us state forms the western boundary of montana
813	summary on the i have a dream speech
818	blood alcohol concentration means the parts of alcohol in the blood in relation to what
825	how much money did the film titanic make
829	what is the symbol for christmas in brazil
831	when was the term prime minister first used
832	who won the mens single ice skating 2018
834	what is cain and abel software used for
837	where was the summer olympics held in 2012
838	what is the meaning of the new zealand flag
843	when was the first season of when calls the heart
844	who said one man's vulgarity is another's lyric
846	what football player is called the honey badger
852	who was the person who escaped from alcatraz
853	where does trick or treat for unicef money go
854	where is the inscription on the statue of liberty
858	who makes the important government decisions in an autocracy
860	which way does the earth orbit the sun
861	who did dwight howard play for last year
870	who does the voice of marceline on adventure time
874	how did the great depression start in canada
875	the names of the beaches on d day
882	how long did it take an ocean liner to cross the atlantic
883	where does the coral sea meet the pacific ocean
886	who started the guinness book of world records
889	who sings i'm going to soak up the sun
895	who played dwight's brother on the office
896	when was corporal punishment banned in south africa
900	when did sierra nevada brewery open in asheville
902	when did the bill of rights come out
905	what's the population of prince edward island
908	where is bermuda located on the world map
914	who sang the song if loving you is wrong i don't want to be right
917	what is the role of anaerobic respiration in living things
918	when did the drinking age turn from 18 to 21
919	where does the band imagine dragons come from
921	what is the function of the cartilaginous rings in the trachea
923	where did the tradition of gift giving come from
924	recitative is a style of delivery that is between singing and speaking
933	what was an economic effect of world war ii
936	who hung the lanterns in the old north church
937	when was the last wolf pack killed in yellowstone
938	when did the vikings first sail and reach britain
939	what is the minimum dollar amount for federal court
941	who sings i wanna rock'n'roll all night
942	what is it called when you believe in greek gods
949	what is the name of the lymphatic vessels located in the small intestine
950	the inner sanctuary of the parthenon where the statue of athena is located in known as the
952	what is the emblematic rhythm of dominican republic
953	what is the difference between governor and chief minister in india
957	where did the easter lily get its name
959	when does season 2 of limitless come out
963	how many us troops does the united states have
968	who sings you're welcome in moana credits
969	who is the coach for the ottawa senators
972	when did sussex split into east and west
973	why does smoke come out of nyc sewers
976	who played shmuel in the boy in the striped pyjamas
979	last world series that didn't go 7 games
982	in neuron the axon ends in a bunch of branches
984	who determines the rules of the us house and us senate
986	what are the lives used for in trivia crack
987	who is the highest paid baseball player in the major leagues
992	where does the spinal cord become cauda equina
996	who plays brad pitt's daughter in moneyball
998	who won season 2 of real chance of love
1000	the house of rules committee is an important part of the legislative process because it
1001	why did france decide to aid the united states in its war for independence
1003	who won the first season of america's got talent
1005	when did ga state get a football team
1007	where is the heart in the human body
1010	what molecule in plants captures energy from the sun
1024	how much space does a fennec fox need
1025	how many gallons of water in the gulf of mexico
1026	anastomosis between the epididymis and the vas deferens
1027	who is given credit for inventing the aqua lung
1030	where was the german fleet scuttled in 1919
1038	who played thelma lou in andy griffith show
1041	what is the genus of a bald eagle
1042	who directed the best years of our lives
1043	what is the function of the notwithstanding clause in the canadian constitution
1048	which layer of the meninges is connected to the brain
1050	where is the heart of palm on a palm tree
1052	what are maria and anita doing when the audience first meets them
1055	who was the band that played in the movie road house
1056	where did the british army launch a successful invasion in 1776
1057	who wrote the guitar solo in beat it
1060	adipose areolar and reticular connective tissues are considered loose connective tissue types
1065	what is the female lion called in lion king
1066	intersection of highways 335 and 35 in saskatchewan
1071	where does dividends go on cash flow statement
1076	when are you considered under the poverty line
1077	who wrote if i were a boy reba or beyonce
1086	where is the citrus bowl held this year
1088	can i be a medic in the marines
1090	who made possible the first reproduction of the human voice on the phonograph
1095	what's the dwarf's name in game of thrones
1098	who hit the first home run in the houston astrodome
1099	whats the movie called with justin timberlake and time
1101	where did the idea of a unicorn come from
1103	what is the number of total presidential electoral votes
1104	where does fungi go on a food web
1107	compared to the event horizon the photon sphere of a black hole is
1108	when did television come out in the us
1110	what effect did russia's signing of the treaty of brest-litovsk have on wwi
1119	where is cuba located on a world map
1124	where do they film take me out fernando's
1127	who played the mom in the partridge family
1128	one important reason for a large variety of wildlife found in india
1129	who directed the iconic animated short educational film ek anek aur ekta
1130	is greenland part of europe or north america
1132	who sang if you had a beautiful body would you hold it against me
1135	when did jelly beans became associated with easter
1138	where is fe best absorbed in the body
1139	bankruptcy abuse prevention and consumer protection act of 2005 summary
1141	when was the last time ny rangers won stanley cup
1151	what advantage does the dealer have in blackjack
1154	what were the wto riots in seattle about
1156	who played cruella de vil in 101 dalmatians
1158	the battle of salamis was significant because it
1159	who plays petyr baelish on game of thrones
1160	who is john snow on game of thrones
1165	where does the pulmonary trunk receive blood from
1167	who has the most trophies in la liga
1168	who's playing in the sec championship 2017
1170	when was the last time the ducks won the stanley cup
1172	who sang the song i wanna be sedated
1173	china in chinese is called zhongguo which means
1175	when did the black death end in england
1178	when did the ouija board first come out
1189	who invented the transtheoretical model of behavior change
1192	who has won the 2018 formula one australia grand prix tournament
1193	how is a triangle a special kind of polygon
1198	who was the famous scientist that ran the research lab moseley went to in manchester
1201	how many blue stripes are on the american flag
1202	zen and the art of motorcycle maintenance buddhism
1203	where did the river thames start and end
1205	what group of animals do octopus belong to
1207	suffix applied to the end of the name of enzymes
1208	when did the tv show the waltons first air
1209	where did the dewey decimal system come from
1210	what was the first light beer in the us
1211	who sings the christmas song all i want for christmas is you
1214	when was the last time clemson won the national championship
1223	who is emma dating in once upon a time
1224	star cast of ab tumhare hawale watan sathiyon
1225	when did the ncaa tournament became more important than the nit
1226	dead poets society where does it take place
1228	is 4matic the same as 4 wheel drive
1231	who sang the song one of these nights
1237	who does demetrius love in a midsummer night dream
1238	who sang our god is an awesome god
1239	where does the term parsons nose come from
1240	forney's sister in where the heart is
